File.Name	Title	URL	Main.Topic	Lizenzart	Author	Second.Author	Organisation	Organisation.Link
DeutschbrauchtesauchfürKrisensituationen.txt	Deutsch braucht es auch für Krisensituationen!	https://www.dasbiber.at/content/deutsch-braucht-es-auch-fuer-krisensituationen			das Biber		das Biber	https://www.dasbiber.at/
MeineElternstörenmichbeimLernen.txt	"Meine Eltern stören mich beim Lernen"	https://www.dasbiber.at/content/meine-eltern-stoeren-mich-beim-lernen			das Biber		das Biber	https://www.dasbiber.at/
Quarantänemitscharf.txt	Quarantäne mit scharf	https://www.dasbiber.at/content/quarantaene-mit-scharf			das Biber		das Biber	https://www.dasbiber.at/
BeiunsfährtniemandmitdemFahrrad.txt	„Bei uns fährt niemand mit dem Fahrrad.“	https://www.dasbiber.at/content/bei-uns-faehrt-niemand-mit-dem-fahrrad			das Biber		das Biber	https://www.dasbiber.at/
MeineHebammeundderArztwerdenMaskentragen.txt	Meine Hebamme und der Arzt werden Masken tragen.	https://www.dasbiber.at/content/meine-hebamme-und-der-arzt-werden-masken-tragen			das Biber		das Biber	https://www.dasbiber.at/
3MinutenmiteinerSparKassiererin.txt	3 Minuten mit einer Spar-Kassiererin	https://www.dasbiber.at/content/3-minuten-mit-erzsebet-hummer			Hannah Jutz;  Zoe Opratko		das Biber	https://www.dasbiber.at/
KlimagerechtigkeitinZeiteneinerPandemie.txt	Klimagerechtigkeit in Zeiten einer Pandemie	https://www.dasbiber.at/content/klimagerechtigkeitin-zeiten-einer-pandemie			das Biber		das Biber	https://www.dasbiber.at/
StreetFoodfürsHomeOfficeSchöneralsDöner.txt	Street Food für's Home-Office - Schöner als Döner	https://www.dasbiber.at/content/street-food-fuers-home-office-schoener-als-doener			das Biber		das Biber	https://www.dasbiber.at/
OlivenwareneinwichtigerTeilmeinerKindheit.txt	„Oliven waren ein wichtiger Teil meiner Kindheit.“	https://www.dasbiber.at/content/oliven-waren-ein-wichtiger-teil-meiner-kindheit			Nada El-Azar,  Zoe Opratko		das Biber	https://www.dasbiber.at/
DievergessenePflegerin.txt	Die vergessene Pflegerin	https://www.dasbiber.at/content/die-vergessene-pflegerin			Valerija Kositer und Jara Majerus,  Zoe Opratko		das Biber	https://www.dasbiber.at/
SchlauDaheimGratisLernhilfeOnline.txt	Schlau Daheim - Gratis Lernhilfe Online.	https://www.dasbiber.at/content/schlau-daheim-gratis-lernhilfe-online			das Biber		das Biber	https://www.dasbiber.at/
LizenzmitSuperkraftWannkommtderCoronaPass.txt	Lizenz mit Superkraft: Wann kommt der Corona-Pass?	https://www.dasbiber.at/content/lizenz-mit-superkraft-wann-kommt-der-corona-pass			das Biber		das Biber	https://www.dasbiber.at/
EineFruchtnamensJack.txt	Eine Frucht namens Jack	https://www.dasbiber.at/content/eine-frucht-namens-jack			das Biber		das Biber	https://www.dasbiber.at/
HäuslicheGewaltinZeitenvonCoronahierfindestduHilfe.txt	Häusliche Gewalt in Zeiten von Corona – hier findest du Hilfe	https://www.dasbiber.at/content/haeusliche-gewalt-zeiten-von-corona-hier-findest-du-hilfe			das Biber		das Biber	https://www.dasbiber.at/
QuarantäneJugoStyle.txt	Quarantäne Jugo-Style	https://www.dasbiber.at/content/quarantaene-jugo-style			Šemsa Salioski		das Biber	https://www.dasbiber.at/
LasstunsüberdasWetterreden.txt	Lasst uns über das Wetter reden.	https://www.dasbiber.at/content/lasst-uns-ueber-das-wetter-reden			Hamed Abboud, LektoratMirjam Steinbock		das Biber	https://www.dasbiber.at/
DemVirusistdeineHautfarbeundReligionegal.txt	"Dem Virus ist deine Hautfarbe und Religion egal."	https://www.dasbiber.at/content/dem-virus-ist-deine-hautfarbe-und-religion-egal			das Biber		das Biber	https://www.dasbiber.at/
KeineKronemehrlesensechsU6TippsgegenCorona.txt	“Keine Krone mehr lesen” - sechs U6 Tipps gegen Corona	https://www.dasbiber.at/content/keine-krone-mehr-lesen-sechs-u6-tipps-gegen-corona			Salma Youssef und Hannah Jutz		das Biber	https://www.dasbiber.at/
GuteNachtEuropa.txt	Gute Nacht, Europa	https://www.dasbiber.at/content/gute-nacht-europa			das Biber		das Biber	https://www.dasbiber.at/
DaswichtigsteWortaufReisen.txt	Das wichtigste Wort auf Reisen	https://www.dasbiber.at/content/das-wichtigste-wort-auf-reisen			Andrea Grman		das Biber	https://www.dasbiber.at/
DasistnichtunserJihad.txt	Das ist nicht unser Jihad	https://www.dasbiber.at/content/das-ist-nicht-unser-jihad			Aleksandra Tulej,  Marko Mestrovic und Zoe Opratko		das Biber	https://www.dasbiber.at/
DerSchreinachTherapie.txt	Der Schrei nach Therapie	https://www.dasbiber.at/content/der-schrei-nach-therapie			Elena Bavandpoori,  Zoe Opratko		das Biber	https://www.dasbiber.at/
BosnierdieIntegrationsstreber.txt	Bosnier, die Integrationsstreber	https://www.dasbiber.at/content/bosnier-die-integrationsstreber			das Biber		das Biber	https://www.dasbiber.at/
3MinutenmitMaryamZaree.txt	3 Minuten mit Maryam Zaree	https://www.dasbiber.at/content/3-minuten-mit-maryam-zarte			das Biber		das Biber	https://www.dasbiber.at/
WhiteDaysforFuture.txt	White Days for Future?	https://www.dasbiber.at/content/white-days-future			Elena Bavandpoori,  Soza Jan		das Biber	https://www.dasbiber.at/
ZumBauchtanzenbrauchtmankeinenBauch.txt	"Zum Bauchtanzen braucht man keinen Bauch."	https://www.dasbiber.at/content/zum-bauchtanzen-braucht-man-keinen-bauch			Nada El-Azar;  Sophie Kirchner		das Biber	https://www.dasbiber.at/
SalutSalam.txt	Salut & Salam!	https://www.dasbiber.at/content/salut-salam			Nada El-Azar,  Susanne Einzenberger		das Biber	https://www.dasbiber.at/
Mamaefica.txt	Mama Šefica	https://www.dasbiber.at/content/mama-sefica			Ivana Cucujkic-Panic		das Biber	https://www.dasbiber.at/
TikTokStarohneGefahr.txt	TikTok-Star ohne Gefahr	https://www.dasbiber.at/content/tiktok-star-ohne-gefahr			Alice Schuhfried		das Biber	https://www.dasbiber.at/
WarummichrechterTerrornichtüberrascht.txt	Warum mich rechter Terror nicht überrascht.	https://www.dasbiber.at/content/warum-mich-rechter-terror-nicht-ueberrascht			das Biber		das Biber	https://www.dasbiber.at/
THÜRIBIZA.txt	THÜRIBIZA	https://www.dasbiber.at/content/thueribiza			das Biber		das Biber	https://www.dasbiber.at/
RechtspopulistenundSalafistentötendieFreiheit.txt	„Rechtspopulisten und Salafisten töten die Freiheit“	https://www.dasbiber.at/content/rechtspopulisten-und-salafisten-toeten-die-freiheit			Delna Antia-Tatić,  Soza Jan		das Biber	https://www.dasbiber.at/
WiensollzurKlimahauptstadtwerden.txt	“Wien soll zur Klimahauptstadt werden”	https://www.dasbiber.at/content/wien-soll-zur-klimahauptstadt-werden			das Biber		das Biber	https://www.dasbiber.at/
HoffnungfürdieverlassenenKinderMoldaus.txt	Hoffnung für die verlassenen Kinder Moldaus	https://www.dasbiber.at/content/hoffnung-fuer-die-verlassenen-kinder-moldaus			Andrija Perkovic 		das Biber	https://www.dasbiber.at/
IchwarbeidemumstrittenenTheaterprojektRepublikInfinitumdabei.txt	Ich war bei dem umstrittenen Theaterprojekt "Republik Infinitum" dabei!	https://www.dasbiber.at/content/ich-war-bei-dem-umstrittenen-theaterprojekt-republik-infinitum-dabei			das Biber		das Biber	https://www.dasbiber.at/
AllerAnfangbeiBiber.txt	Aller Anfang bei Biber	https://www.dasbiber.at/content/aller-anfang-bei-biber			Aleksandra Tulej		das Biber	https://www.dasbiber.at/
FeminismushilftunsMenschzuwerden.txt	„Feminismus hilft uns, Mensch zu werden“	https://www.dasbiber.at/content/feminismus-hilft-uns-mensch-zu-werden			Elena Bavandpoori		das Biber	https://www.dasbiber.at/
InderKabinerufenalleBrate.txt	In der Kabine rufen alle „Brate“	https://www.dasbiber.at/content/der-kabine-rufen-alle-brate			Amar Rajković und Christoph Liebentritt		das Biber	https://www.dasbiber.at/
IchpaffnichtDaddy.txt	Ich paff' nicht, Daddy!	https://www.dasbiber.at/content/ich-paff-nicht-daddy			das Biber		das Biber	https://www.dasbiber.at/
VomLehrlingzumBoss.txt	Vom Lehrling zum Boss	https://www.dasbiber.at/content/vom-lehrling-zum-boss			Anna Jandrisevits,  Christoph Liebentritt		das Biber	https://www.dasbiber.at/
DerTeufelträgtwei.txt	Der Teufel trägt weiß	https://www.dasbiber.at/content/der-teufel-traegt-weiss			Florentina Glüxam,  Christoph Liebentritt		das Biber	https://www.dasbiber.at/
EsnimmtdieMenschenunnötigineineKrisemitdiesienichtverursachthaben.txt	„Es nimmt die Menschen unnötig in eine Krise mit, die sie nicht verursacht haben.“	https://www.dasbiber.at/content/es-nimmt-die-menschen-unnoetig-eine-krise-mit-die-sie-nicht-verursacht-haben			Nada El-Azar		das Biber	https://www.dasbiber.at/
Sissiarabesk.txt	Sissi arabesk	https://www.dasbiber.at/content/sissi-arabesk-0			Ivana Cucujkic-Panic		das Biber	https://www.dasbiber.at/
MeineFreundefragenmichumfinanziellenRat.txt	„Meine Freunde fragen mich um finanziellen Rat“	https://www.dasbiber.at/content/meine-freunde-fragen-mich-um-finanziellen-rat			Florentina Glüxam​		das Biber	https://www.dasbiber.at/
TantrasexundWüstenstaub.txt	Tantrasex und Wüstenstaub	https://www.dasbiber.at/content/destination-spanische-wueste			Andrea Grman		das Biber	https://www.dasbiber.at/
IchbinkeinTäter..undauchkeinOpfer.txt	„Ich bin kein Täter... und auch kein Opfer!“	https://www.dasbiber.at/content/ich-bin-kein-taeter-und-auch-kein-opfer			Aleksandra Tulej und Amar Rajkovic,  Soza Jan		das Biber	https://www.dasbiber.at/
Hochsensibel.txt	Hochsensibel	https://www.dasbiber.at/content/hochsensibel			Jelena Colic,  Maximilian Salzer		das Biber	https://www.dasbiber.at/
LehreundStudiumDasgeht.txt	Lehre und Studium - Das geht!	https://www.dasbiber.at/content/lehre-und-studium-das-geht			Sueda Altinay,  Soza Jan		das Biber	https://www.dasbiber.at/
AucheinAnwaltbrauchtElektriker.txt	„Auch ein Anwalt braucht Elektriker“	https://www.dasbiber.at/content/auch-ein-anwalt-braucht-elektriker			Sueda Altinay und Florentina Glüxam,  Christoph Liebentritt		das Biber	https://www.dasbiber.at/
LieberFuballalsDiktate.txt	"Lieber Fußball als Diktate."	https://www.dasbiber.at/content/lieber-fussball-als-diktate			Amar Rajković		das Biber	https://www.dasbiber.at/
OhneGretaThunberggäbeesdieBewegungnicht.txt	"Ohne Greta Thunberg gäbe es die Bewegung nicht"	https://www.dasbiber.at/content/ich-bin-da-eher-optimistisch			Wolfgang Mitterlehner,  Soza Jan		das Biber	https://www.dasbiber.at/
MitZerozumHero.txt	Mit Zero zum Hero	https://www.dasbiber.at/content/mit-zero-zum-hero			Ivana Cucujkić-Panić und Julie Brass 		das Biber	https://www.dasbiber.at/
IchbindasKindeinerarrangiertenEhe.txt	Ich bin das Kind einer arrangierten Ehe	https://www.dasbiber.at/content/ich-bin-das-kind-einer-arrangierten-ehe			Sueda Altinay,  Privat		das Biber	https://www.dasbiber.at/
3MinutenmitYannickShetty.txt	3 Minuten mit Yannick Shetty	https://www.dasbiber.at/content/yannick-shetty			Sueda Altinay, Amar Rajković,  Marko Mestrović		das Biber	https://www.dasbiber.at/
MeinGotthilfmirdiesetödlicheLiebezuüberleben.txt	„Mein Gott, hilf mir, diese tödliche Liebe zu überleben“	https://www.dasbiber.at/content/mein-gott-hilf-mir-diese-toedliche-liebe-zu-ueberleben			Andrija Perkovic		das Biber	https://www.dasbiber.at/
VergissSexandtheCity.txt	Vergiss Sex and the City.	https://www.dasbiber.at/content/vergiss-sex-and-city			das Biber		das Biber	https://www.dasbiber.at/
HeyBabyStillenisthart.txt	Hey Baby - Stillen ist hart.	https://www.dasbiber.at/content/hey-baby			das Biber		das Biber	https://www.dasbiber.at/
GehenGeldundRomantikzusammen.txt	Gehen Geld und Romantik zusammen?	https://www.dasbiber.at/content/gehen-geld-und-romantik-zusammen			das Biber		das Biber	https://www.dasbiber.at/
SichwieeinStarfühlen.txt	Sich wie ein Star fühlen	https://www.dasbiber.at/content/selbermachen-sich-wie-ein-star-fuehlen			das Biber		das Biber	https://www.dasbiber.at/
PerAnhalterinsgeorgischeKloster.txt	Per Anhalter ins georgische Kloster	https://www.dasbiber.at/content/anhalter-ins-georgische-kloster			das Biber		das Biber	https://www.dasbiber.at/
GesuchtElternaufZeit.txt	Gesucht: Eltern auf Zeit	https://www.dasbiber.at/content/gesucht-eltern-auf-zeit			das Biber		das Biber	https://www.dasbiber.at/
DerBabavonMeidling.txt	Der Baba von Meidling	https://www.dasbiber.at/content/der-baba-von-meidling			das Biber		das Biber	https://www.dasbiber.at/
DasKindmussweg.txt	Das Kind muss weg.	https://www.dasbiber.at/content/das-kind-muss-weg			das Biber		das Biber	https://www.dasbiber.at/
3FragenanMenervaHammad.txt	3 Fragen an Menerva Hammad	https://www.dasbiber.at/content/3-fragen-menerva-hammad			das Biber		das Biber	https://www.dasbiber.at/
WirhabenkeineNoGoAreas.txt	„Wir haben keine No-Go-Areas"	https://www.dasbiber.at/content/wir-haben-keine-no-go-areas			Amar Rajković, Delna Antia-Tatić,  Marko Mestrović		das Biber	https://www.dasbiber.at/
HerrFlüchtlingdasistunserLand.txt	"Herr Flüchtling, das ist unser Land!"	https://www.dasbiber.at/content/herr-fluechtling-das-ist-unser-land-2			das Biber		das Biber	https://www.dasbiber.at/
VATERUNSERSexuellerMissbrauchinderkatholischenKirche.txt	VATER UNSER - Sexueller Missbrauch in der katholischen Kirche	https://www.dasbiber.at/content/vater-unser-sexueller-missbrauch-der-katholischen-kirche			das Biber		das Biber	https://www.dasbiber.at/
TheJungleDasFlüchtlingscampaufderbosnischenMüllhalde.txt	"The Jungle" - Das Flüchtlingscamp auf der bosnischen Müllhalde	https://www.dasbiber.at/content/jungle-das-fluechtlingscamp-auf-der-bosnischen-muellhalde			Petar Rosandić, Murtaza Elham		das Biber	https://www.dasbiber.at/
3MinutenmitKarlMarkovicsBorhanHassanZadeh.txt	3 Minuten mit Karl Markovics & Borhan Hassan Zadeh	https://www.dasbiber.at/content/3-minuten-mit-karl-markovics-borhan-hassan-zadeh			das Biber		das Biber	https://www.dasbiber.at/
Jugönnsmirdoch.txt	Jugönns mir doch!	https://www.dasbiber.at/content/jugoenns-mir-doch			Jelena Čolić, Mitarbeit Amar Rajković,  Marko Mestrović		das Biber	https://www.dasbiber.at/
TarikMeteIchvermeidedasWortGastarbeiter.txt	Tarik Mete: „Ich vermeide das Wort Gastarbeiter“	https://www.dasbiber.at/content/ich-vermeide-das-wort-gastarbeiter			Amar Rajkovic und Christoph Liebentritt 		das Biber	https://www.dasbiber.at/
Ifyoueducateawomanyoueducateanation.txt	If you educate a woman, you educate a nation.	https://www.dasbiber.at/content/if-you-educate-woman-you-educate-nation			das Biber		das Biber	https://www.dasbiber.at/
DaswirdÖsterreichserstesmobilesEscapeGame.txt	Das wird Österreichs erstes mobiles Escape-Game.	https://www.dasbiber.at/content/das-wird-oesterreichs-erster-mobiler-escape-room			das Biber		das Biber	https://www.dasbiber.at/
DieUnternehmerausdemAusland.txt	Die Unternehmer aus dem Ausland	https://www.dasbiber.at/content/die-unternehmer-aus-dem-ausland			Armin Nadjafkhani		das Biber	https://www.dasbiber.at/
WachaufLaraisttotEineFraudiedenHisbollahTerrorüberlebthat.txt	„Wach auf! Lara ist tot“ – Eine Frau, die den Hisbollah-Terror überlebt hat	https://www.dasbiber.at/content/wach-auf-lara-ist-tot-eine-frau-die-den-hisbollah-terror-ueberlebt-hat			Armin Nadjafkhani		das Biber	https://www.dasbiber.at/
EndlichkeineFerienmehr.txt	Endlich keine Ferien mehr!	https://www.dasbiber.at/content/endlich-keine-ferien-mehr			Ivana Cucujkić		das Biber	https://www.dasbiber.at/
Pärchenpolitik.txt	Pärchenpolitik	https://www.dasbiber.at/content/paerchenpolitik			Anna Jandrisevits, Illustrationen Mariella Lehner		das Biber	https://www.dasbiber.at/
ArbeitemitdeinemKopfnichtmitdeinemKörper.txt	Arbeite mit deinem Kopf, nicht mit deinem Körper	https://www.dasbiber.at/content/arbeite-mit-deinem-kopf-nicht-mit-deinem-koerper			das Biber		das Biber	https://www.dasbiber.at/
OhneAbschlusskeinAuszug.txt	Ohne Abschluss kein Auszug	https://www.dasbiber.at/content/ohne-abschluss-kein-auszug			Aleksandra Tulej,  Christoph Liebentritt		das Biber	https://www.dasbiber.at/
DieKleinenandieMacht.txt	Die Kleinen an die Macht!	https://www.dasbiber.at/content/die-kleinen-die-macht			Amar Rajković		das Biber	https://www.dasbiber.at/
ArminfragtNicoleBinicheinFeminist.txt	Armin fragt Nicole: "Bin ich ein Feminist?"	https://www.dasbiber.at/content/armin-fragt-nicole-bin-ich-ein-feminist			das Biber		das Biber	https://www.dasbiber.at/
SexarbeitistauchArbeitDieMigrantSexWorkersimGespräch.txt	"Sexarbeit ist auch Arbeit" - Die Migrant Sex Workers im Gespräch	https://www.dasbiber.at/content/sexarbeit-ist-auch-arbeit-die-migrant-sex-workers-im-gespraech			Nada El-Azar,  Marko Mestrovic		das Biber	https://www.dasbiber.at/
AufeinenSpritzermitMichaelHäuplÜberWahlenundFinsterlinge.txt	Auf einen Spritzer mit Michael Häupl: Über Wahlen und Finsterlinge	https://www.dasbiber.at/content/auf-einen-spritzer-mit-michael-haeupl-ueber-wahlen-und-finsterlinge			Simon Kravagna,  Marko Mestrovic		das Biber	https://www.dasbiber.at/
WiensSchickeriaHipsterundwirAuftaktderMQViennaFashionWeek.txt	Wiens Schickeria, Hipster und wir - Auftakt der MQ Vienna Fashion Week	https://www.dasbiber.at/content/mq-vienna-fashion-week-2019			das Biber		das Biber	https://www.dasbiber.at/
WirspielenkeineTschuschnkapelleimInterviewmitZeynepArslan.txt	"Wir spielen keine Tschuschnkapelle" - im Interview mit Zeynep Arslan	https://www.dasbiber.at/content/wir-spielen-keine-tschuschnkapelle-im-interview-mit-zeynep-arslan			Jelena Colic		das Biber	https://www.dasbiber.at/
BareRapperundRisikomanager.txt	Bare$: Rapper und Risikomanager	https://www.dasbiber.at/content/bare-rapper-und-risikomanager			Armin Nadjafkhani,  Sophie Kirchner		das Biber	https://www.dasbiber.at/
WandelistkeineEintagsfliegeInterviewmitFayadMulla.txt	„Wandel ist keine Eintagsfliege“ – Interview mit Fayad Mulla	https://www.dasbiber.at/content/wandel-ist-keine-eintagsfliege-interview-mit-fayad-mulla			das Biber		das Biber	https://www.dasbiber.at/
TakeoverimWienMuseum.txt	Takeover im Wien Museum	https://www.dasbiber.at/content/takeover-im-wien-museum			Nada El-Azar,  Aida Duric		das Biber	https://www.dasbiber.at/
BibersuchtMitbewohner.txt	Biber sucht Mitbewohner!	https://www.dasbiber.at/content/biber-sucht-mitbewohner-0			das Biber		das Biber	https://www.dasbiber.at/
DerRassismusderAnderen.txt	Der Rassismus der Anderen.	https://www.dasbiber.at/content/der-rassismus-der-anderen			Emir Dizdarevic		das Biber	https://www.dasbiber.at/
EsistZeitunsereeigeneGeschichtezuschreiben.txt	„Es ist Zeit, unsere eigene Geschichte zu schreiben“	https://www.dasbiber.at/content/es-ist-zeit-unsere-eigene-geschichte-zu-schreiben			Cecilia Tradowsky,  Marko Mestrovic		das Biber	https://www.dasbiber.at/
UrlaubaufeigeneGefahr.txt	Urlaub auf eigene Gefahr!	https://www.dasbiber.at/content/urlaub-auf-eigene-gefahr			Aleksandra Tulej, Lisa Kiesenhofer, Anna Helm, Cecilia Tradowsky und Amar Rajkovic		das Biber	https://www.dasbiber.at/
Mixitlikeagirl.txt	Mix it like a girl!	https://www.dasbiber.at/content/mix-it-girl			das Biber		das Biber	https://www.dasbiber.at/
FashionmeetsCharity.txt	Fashion meets Charity	https://www.dasbiber.at/content/fashion-meets-charity			Nada El-Azar,  Susanne Einzenberger		das Biber	https://www.dasbiber.at/
FKKNaklar.txt	FKK? Na klar!	https://www.dasbiber.at/content/fkk-na-klar			das Biber		das Biber	https://www.dasbiber.at/
AufeinenSpritzermitMichaelHäupl.txt	Auf einen Spritzer mit Michael Häupl	https://www.dasbiber.at/content/auf-einen-spritzer-mit-michael-haeupl			das Biber		das Biber	https://www.dasbiber.at/
DruffDruffDruff.txt	Druff, Druff, Druff	https://www.dasbiber.at/content/druff-druff-druff			Aleksandra Tulej,  Christoph Liebentritt		das Biber	https://www.dasbiber.at/
GebtmirmeineSchwesterzurück.txt	"Gebt mir meine Schwester zurück!"	https://www.dasbiber.at/content/gebt-mir-meine-schwester-zurueck			Anna Caterina Helm		das Biber	https://www.dasbiber.at/
KreditkartenfürJesus.txt	Kreditkarten für Jesus	https://www.dasbiber.at/content/kreditkarten-fuer-jesus			Anna Jandrisevits		das Biber	https://www.dasbiber.at/
HerrKoglerwieoftgendernSietäglich.txt	"Herr Kogler, wie oft gendern Sie täglich?"	https://www.dasbiber.at/content/herr-kogler-wie-oft-gendern-sie-taeglich			das Biber		das Biber	https://www.dasbiber.at/
3MinutenmitEdinIbrahimovi.txt	3 Minuten mit Edin Ibrahimović	https://www.dasbiber.at/content/3-minten-mit-edin-ibrahimovic			Lisa Kiesenhofer und Christoph Liebentritt 		das Biber	https://www.dasbiber.at/
DerKampfumdenDampf.txt	Der Kampf um den Dampf	https://www.dasbiber.at/content/der-kampf-um-den-dampf			Lisa Kiesenhofer		das Biber	https://www.dasbiber.at/
DassagtunseramerikanischerPraktikantzumKurzGebet.txt	Das sagt unser amerikanischer Praktikant zum Kurz-Gebet	https://www.dasbiber.at/content/das-sagt-unser-amerikanischer-praktikant-zum-kurz-gebet			das Biber		das Biber	https://www.dasbiber.at/
EinevabicainBosnien.txt	Eine Švabica in Bosnien	https://www.dasbiber.at/content/eine-svabica-bosnien			Anna Jandrisevits		das Biber	https://www.dasbiber.at/
EinHerzundeineMähne.txt	Ein Herz und eine Mähne	https://www.dasbiber.at/content/ein-herz-und-eine-maehne			Ivana Cucujkić-Panić und Julie Brass 		das Biber	https://www.dasbiber.at/
MeineTochtermeinePerle.txt	Meine Tochter, meine Perle	https://www.dasbiber.at/content/meine-tochter-meine-perle			Nada El-Azar		das Biber	https://www.dasbiber.at/
JUNGBRUTALKRIMINELL.JugendgangsinWien.txt	JUNG,BRUTAL, KRIMINELL. Jugendgangs in Wien	https://www.dasbiber.at/content/jung-brutal-kriminell-jugendgangs-wien			Aleksandra Tulej,  Marko Mestrović		das Biber	https://www.dasbiber.at/
Islamundvegan.txt	Islam und vegan	https://www.dasbiber.at/content/islam-und-vegan			das Biber		das Biber	https://www.dasbiber.at/
HerrPetznerwieoftträumenSievonJörgHaider.txt	"Herr Petzner, wie oft träumen Sie von Jörg Haider?"	https://www.dasbiber.at/content/herr-petzner-wie-oft-traeumen-sie-von-joerg-haider			das Biber		das Biber	https://www.dasbiber.at/
RotistdieFarbedesBlutesdesLebensunddesKampfes.txt	"Rot ist die Farbe des Blutes, des Lebens und des Kampfes"	https://www.dasbiber.at/content/rot-ist-die-farbe-des-blutes-des-lebens-und-des-kampfes			das Biber		das Biber	https://www.dasbiber.at/
FaceoftheMonthLilZoo.txt	Face of the Month: Lil Zoo	https://www.dasbiber.at/content/face-month-lil-zoo			Šemsa Salioski		das Biber	https://www.dasbiber.at/
NichtdassernochSchwulwird.txt	Nicht, dass er noch Schwul wird!!	https://www.dasbiber.at/content/nicht-dass-er-noch-schwul-wird			das Biber		das Biber	https://www.dasbiber.at/
WarumSuperfoodsnichtfürjedensupersind.txt	Warum Superfoods nicht für jeden super sind	https://www.dasbiber.at/content/warum-superfoods-nicht-fuer-jeden-super-sind			Cecilia Tradowsky und Anna Caterina Helm		das Biber	https://www.dasbiber.at/
3MinutenmitEbruK.txt	3 Minuten mit Ebru K.	https://www.dasbiber.at/content/3-minuten-mit-ebru-k			Aleksandra Tulej,  Marko Mestrovic		das Biber	https://www.dasbiber.at/
AllesfürdieTonneDasMüllExperiment.txt	Alles für die Tonne - Das Müll-Experiment	https://www.dasbiber.at/content/alles-fuer-die-tonne-das-muell-experiment			Stefan Pscheider,  Christoph Liebentritt		das Biber	https://www.dasbiber.at/
MehralsnurTschuschencomedy.txt	Mehr als nur Tschuschencomedy	https://www.dasbiber.at/content/mehr-als-nur-tschuschencomedy			Melisa Erkurt,  Marko Mestrović		das Biber	https://www.dasbiber.at/
WiegehtPedikürelaOligarchennichte.txt	Wie geht Pediküre à la Oligarchennichte?	https://www.dasbiber.at/content/wie-geht-pedikuere-la-oligarchennichte			Lisa Kiesenhofer und Anna Caterina Helm		das Biber	https://www.dasbiber.at/
Abtreibungundglücklichdarfmandas.txt	Abtreibung und glücklich - darf man das?	https://www.dasbiber.at/content/abtreibung-und-gluecklich-darf-man-das			das Biber		das Biber	https://www.dasbiber.at/
DieWeltderNazismachtunssprachlos.txt	Die Welt der Nazis macht uns sprachlos	https://www.dasbiber.at/content/die-welt-der-nazis-macht-uns-sprachlos			Lisa Kiesenhofer		das Biber	https://www.dasbiber.at/
WirsinddiestilleMehrheitdienichtmitSachenwirft.txt	„Wir sind die stille Mehrheit, die nicht mit Sachen wirft!“	https://www.dasbiber.at/content/wir-sind-die-stille-mehrheit-die-nicht-mit-sachen-wirft			Lisa Kiesenhofer,  Marko Mestrovic		das Biber	https://www.dasbiber.at/
SechsGründewarumwirdieEUlieben.txt	Sechs Gründe, warum wir die EU lieben.	https://www.dasbiber.at/content/sechs-gruende-warum-wir-die-eu-lieben			Sandro Nicolussi		das Biber	https://www.dasbiber.at/
DieBadMomsvonInstagram.txt	Die Bad Moms von Instagram	https://www.dasbiber.at/content/die-bad-moms-von-instagram			Aleksandra Tulej		das Biber	https://www.dasbiber.at/
AusgeliefertüberfordertgedemütigtwennGeburttraumatisiert.txt	Ausgeliefert, überfordert, gedemütigt - wenn Geburt traumatisiert.	https://www.dasbiber.at/content/das-intime-ist-politisch			Delna Antia-Tatić,  Marko Mestrović		das Biber	https://www.dasbiber.at/
MyBreastFriends.txt	My Breast Friends	https://www.dasbiber.at/content/my-breast-friends			Ivana Cucujkic-Panic,  Elsa Okazaki		das Biber	https://www.dasbiber.at/
DerPapaistnichtda.txt	Der Papa ist nicht da!	https://www.dasbiber.at/content/der-papa-ist-nicht-da			das Biber		das Biber	https://www.dasbiber.at/
HerrVuralwieofthabenSieAlkoholgetrunken.txt	Herr Vural, wie oft haben Sie Alkohol getrunken?	https://www.dasbiber.at/content/herr-vural-wie-oft-haben-sie-alkohol-getrunken			das Biber		das Biber	https://www.dasbiber.at/
3MinutenmitMarcosNader.txt	3 Minuten mit Marcos Nader	https://www.dasbiber.at/content/3-minuten-mit-marcos-nader			Aleksandra Tulej,  Marko Mestrovic		das Biber	https://www.dasbiber.at/
NatürlichvermisseichmeinKind.txt	"Natürlich vermisse ich mein Kind"	https://www.dasbiber.at/content/natuerlich-vermisse-ich-mein-kind			Delna Antia-Tatić,  Marko Mestrović		das Biber	https://www.dasbiber.at/
BioDelikatessenmitsozialemPlus.txt	Bio-Delikatessen mit sozialem Plus	https://www.dasbiber.at/content/bio-delikatessen-mit-sozialem-plus			das Biber		das Biber	https://www.dasbiber.at/
Parentingunfiltered.txt	Parenting unfiltered	https://www.dasbiber.at/content/parenting-unfiltered			Ivana Cucujkic-Panic		das Biber	https://www.dasbiber.at/
